{
  "$schema": "https://json-schema.org/draft/2020-12/schema",
  "$id": "https://mobile-agent.local/schemas/skill-manifest/v1.json",
  "title": "Skill Manifest",
  "type": "object",
  "additionalProperties": false,
  "required": [
    "schema_version",
    "id",
    "version",
    "name",
    "description",
    "kind",
    "input_schema",
    "output_schema",
    "required_capabilities",
    "tool_allowlist",
    "risk",
    "timeout_seconds",
    "max_steps",
    "verification"
  ],
  "properties": {
    "schema_version": { "const": "1.0.0" },
    "id": { "type": "string", "pattern": "^[a-z][a-z0-9]*(?:\\.[a-z][a-z0-9_]*)+$" },
    "version": { "type": "string", "pattern": "^[0-9]+\\.[0-9]+\\.[0-9]+$" },
    "name": { "type": "string", "minLength": 1, "maxLength": 100 },
    "description": { "type": "string", "minLength": 1, "maxLength": 500 },
    "kind": { "enum": ["deterministic", "agentic"] },
    "input_schema": { "type": "object" },
    "output_schema": { "type": "object" },
    "required_capabilities": {
      "type": "array",
      "minItems": 1,
      "uniqueItems": true,
      "items": { "type": "string", "minLength": 1 }
    },
    "tool_allowlist": {
      "type": "array",
      "minItems": 1,
      "uniqueItems": true,
      "items": { "type": "string", "minLength": 1 }
    },
    "risk": { "enum": ["low", "medium", "high", "prohibited"] },
    "timeout_seconds": { "type": "integer", "minimum": 1, "maximum": 1800 },
    "max_steps": { "type": "integer", "minimum": 1, "maximum": 100 },
    "verification": { "type": "string", "minLength": 1 }
  }
}
